date,title,url,sourceName
8.1.2020,WHO says mysterious illness in China likely being caused by new virus,https://www.statnews.com/2020/01/08/who-says-mysterious-illness-in-china-likely-being-caused-by-new-virus/,Stat News
9.1.2020,"A new virus related to SARS is the culprit in China's mysterious pneumonia outbreak, scientists say",https://edition.cnn.com/2020/01/08/health/china-wuhan-pneumonia-virus-intl-hnk/index.html,CNN
10.1.2020,China Reports First Death From New Virus,https://www.nytimes.com/2020/01/10/world/asia/china-virus-wuhan-death.html,NYT
23.1.2020,China coronavirus: Lockdown measures rise across Hubei province,https://www.bbc.com/news/world-asia-china-51217455,BBC
31.1.2020,Coronavirus declared global health emergency by WHO,https://www.bbc.com/news/world-51318246,BBC
31.1.2020,How to Prepare for a Coronavirus Pandemic,https://www.foreignaffairs.com/articles/china/2020-01-31/how-prepare-coronavirus-pandemic,Foreign Affairs
11.2.2020,Coronavirus 'could infect 60% of global population if unchecked',https://www.theguardian.com/world/2020/feb/11/coronavirus-expert-warns-infection-could-reach-60-of-worlds-population,The Guardian
15.2.2020,"To Tame Coronavirus, Mao-Style Social Control Blankets China",https://www.nytimes.com/2020/02/15/business/china-coronavirus-lockdown.html,NYT
24.2.2020,You’re Likely to Get the Coronavirus,https://www.theatlantic.com/health/archive/2020/02/covid-vaccine/607000/,The Atlantic
26.2.2020,Suomalaisnainen saanut koronavirustartunnan Italiasta,https://yle.fi/uutiset/3-10897264,YLE
19.2.2020,Two Iranians die after testing positive for coronavirus,https://www.cnbc.com/2020/02/19/two-iranians-die-after-testing-positive-for-coronavirus.html,CNBC
6.3.2020,Tätä koronaviruksesta selvitetään nyt kiireellisesti,https://yle.fi/uutiset/3-11244867,YLE
9.3.2020,Ulkoministeriö kehottaa välttämään matkustamista,https://www.iltalehti.fi/koronavirus/a/cba2717e-3443-4c4e-9a05-947b4a1595e3,Iltalehti
9.3.2020,"Worst day in a decade: Nasdaq, S&P, Dow down nearly 8% in massive market rout",https://fortune.com/2020/03/09/dow-jones-sp-500-today-nasdaq-stock-market-crash-2020/,Fortune
10.3.2020,Coronavirus: Italy extends emergency measures nationwide,https://www.bbc.com/news/world-europe-51810673,BBC
11.3.2020,World Health Organization calls coronavirus outbreak 'pandemic' for first time,https://www.reuters.com/article/us-health-coronavirus-who/world-health-organization-describes-coronavirus-outbreak-as-pandemic-idUSKBN20Y2OI,Reuters
12.3.2020,HS avaa koronavirusta koskevat uutiset luettavaksi maksutta,https://www.hs.fi/kotimaa/art-2000006436826.html,HS
12.3.2020,Puolueet antoivat tukensa valmiuslain käyttöönottoon tarvittaessa,https://yle.fi/uutiset/3-11254339,YLE
21.3.2020,Uusimmat tiedot koronaviruksesta,https://yle.fi/uutiset/3-11212596,YLE
13.3.2020,Koronavirus saattaa vaurioittaa keuhkoja – osalla toimintakyky voi heikentyä jopa 30 prosentilla,https://www.scmp.com/news/hong-kong/health-environment/article/3074988/coronavirus-some-recovered-patients-may-have,SCMP
13.3.2020,Hengityskoneista pulaa Euroopassa – Saksassa armeija komennettu apuu,https://www.ft.com/content/5a2ffc78-6550-11ea-b3f3-fe4680ea68b5,FT
14.3.2020,Koronaviruksen aiheuttamat kuolemat kaksinkertaistuivat Yhdistyneessä kuningaskunnassa,https://www.bbc.com/news/uk-51889957,BBC
13.3.2020,Coronavirus: can herd immunity really protect us?,https://theconversation.com/coronavirus-can-herd-immunity-really-protect-us-133583,theconversation
14.3.2020,Infected people without symptoms might be driving the spread of coronavirus more than we realized,https://edition.cnn.com/2020/03/14/health/coronavirus-asymptomatic-spread/index.html,CNN
15.3.2020,UK health secretary calls on industry to switch to making ventilators,https://www.politico.eu/article/uk-health-secretary-calls-on-industry-to-switch-to-making-ventilators/,Politico
15.3.2020,Koronakriisi on jo saanut Ruotsin kysymään ruokaa Suomesta – Naapurimaan omavaraisuusaste historiallisen alhainen,https://yle.fi/uutiset/3-11257376,YLE
15.3.2020,Kova arvio HUSista: ”Pulaa voi epidemiatilanteessa tulla sekä sairaalasängyistä että käsipareista”,https://www.uusisuomi.fi/uutiset/kova-arvio-husista-pulaa-voi-epidemiatilanteessa-tulla-seka-sairaalasangyista-etta-kasipareista/578aefcc-535c-4ebb-b7ef-a5db64275273,Uusi Suomi
14.3.2020,Trumpin koronavirustesti negatiivinen ,https://www.nytimes.com/2020/03/14/us/politics/trump-virus-test.html,NYT
13.3.2020,"Worst-case coronavirus scenario: 214 million Americans infected, 1.7 million dead",https://www.technologyreview.com/s/615358/worst-case-coronavirus-scenario-214-million-americans-infected-17-million-dead/,technologyreview
15.3.2020,"Aggressiivisesta testaamisesta olisi hyötyä Suomessakin, mutta nyt siihen ei kyetä, sanoo Husin johtaja­ylilääkäri",https://www.hs.fi/kotimaa/art-2000006440582.html,HS
16.3.2020,HL:n pääjohtaja Markku Tervahauta Ylellä: Suomessa voi olla todellisuudessa 20-30 kertaa enemmän koronaviruksen saaneita,https://www.mtvuutiset.fi/artikkeli/thl-n-paajohtaja-markku-tervahauta-ylella-suomessa-voi-olla-todellisuudessa-20-30-kertaa-enemman-koronaviruksen-saaneita/7762944#gs.0he22f,MTV3
16.3.2020,The incompetence pandemic ,https://www.politico.com/news/2020/03/16/coronavirus-pandemic-leadership-131540,Politico
15.3.2020,‘Like drowning in air: lung damage from serious coronavirus cases may take years to heal,https://www.theaustralian.com.au/world/the-times/like-drowning-in-air-lung-damage-from-serious-coronavirus-cases-may-take-years-to-heal/news-story/45e58e0725a93870bdc11491786e2f6e?fbclid=IwAR12MAXqg__MY8Y51mtPAHrGXv9sNjrkS5Ov_6hntw8yzb7HsdP4NoWLXyc,The Australian
15.3.2020,UK coronavirus crisis 'to last until spring 2021 and could see 7.9m hospitalised' ,https://www.theguardian.com/world/2020/mar/15/uk-coronavirus-crisis-to-last-until-spring-2021-and-could-see-79m-hospitalised?fbclid=IwAR1KJli_781D5aVn0d6jfAb3e1QUWg4W2OLhEi19qYzKR05u_7rOmCsOdKk,The Guardian
14.3.2020,France Warns Against Use of Anti-Inflammatory Drugs to Tackle Coronavir,https://www.nytimes.com/reuters/2020/03/14/world/europe/14reuters-health-coronavirus-france-drug.html,NYT
14.3.2020,"THL:n tutkimusprofessori emeritus koronaepidemiasta: ""Useimmat COVID-19 kuolemat eivät ole väistämättömiä""",https://www.maaseuduntulevaisuus.fi/kotimaa/artikkeli-1.1020202,Maaseudun Tulevaisuus
17.3.2020,Hallitus julisti poikkeusolot,https://www.uusisuomi.fi/uutiset/us/39501cca-6a5d-4e4b-8b4e-a7201988f995,Uusi Suomi
17.3.2020,"Hallitus tiedottaa valmiuslaista tänään kello 15, Suomessa tehty 3 000 koronavirustestiä",https://www.hs.fi/kotimaa/art-2000006440845.html,HS
17.3.2020,Coronavirus: Australian scientists map how immune system fights virus,https://www.bbc.com/news/world-australia-51921403,BBC
16.3.2020,"Coronavirus drugs: Who's doing what, and when they might come",https://medicalxpress.com/news/2020-03-coronavirus-drugs.html,medicalxpress
16.3.2020,WHO chief calls for widespread virus testing as Europe locks down,https://medicalxpress.com/news/2020-03-case-covid-.html,medicalxpress
17.3.2020,Koronakriisi on jo saanut Ruotsin kysymään ruokaa Suomesta – Naapurimaan omavaraisuusaste historiallisen alhainen,https://www.maaseuduntulevaisuus.fi/ruoka/artikkeli-1.1022446?fbclid=IwAR2e7rLl9BUWD7Kp-ZuU4wHGty4cTfluWZWM6GHrrn5VHcd9UYY3f20XeGY,Maaseudun Tulevaisuus
16.3.2020,Hong Kong Shutdown a Lesson to the World in Halting Virus,https://www.bloomberg.com/news/articles/2020-03-16/hong-kong-shutdown-is-a-lesson-to-the-world-in-halting-the-virus,Bloomberg
17.3.2020,"Europe’s Doctors Repeat Errors Made in Wuhan, China Medics Say",https://www.bloomberg.com/news/articles/2020-03-17/europe-s-doctors-getting-sick-like-in-wuhan-chinese-doctors-say?srnd=premium-europe,Bloomberg
17.3.2020,Coronavirus upends justice system as states close courts and halt trials,https://www.nbcnews.com/news/us-news/coronavirus-upends-justice-system-states-close-courts-halt-trials-n1160961,NBC
17.3.2020,"Professori Lasse Lehtonen: Jos koronaan sairastuneita on 35 prosenttia, tehohoitoa voidaan antaa 15 prosentille sitä tarvitsevista ",https://www.iltalehti.fi/koronavirus/a/ef9d8f81-ab6d-4ac4-92e1-8b59bdad5702,Iltalehti
17.3.2020,Helsinki avaa toisen koronaterveysaseman Malmille – toimi näin ennen terveysasemalle menoa,https://www.iltalehti.fi/koronavirus/a/7a70930f-2f55-47e9-beb5-879a3472824b,Iltalehti
17.3.2020,Suomessa yli 300 koronavirustartuntaa – osa tarvinnut sairaalahoitoa,https://www.iltalehti.fi/koronavirus/a/94bda098-1ca1-466e-a55b-b467e901d013,Iltalehti
17.3.2020,"Uusimmat tiedot koronaviruksesta: Suomessa nyt 319 varmennettua tartuntaa, Matkailu- ja ravintola-alan liikevaihdosta suli 70 prosenttia, Kiinassa vain yksi tartunta",https://yle.fi/uutiset/3-11212596,YLE
17.3.2020,Sweeping restrictions take effect in coronavirus response as health officials warn US is at a tipping point,https://edition.cnn.com/2020/03/17/health/us-coronavirus-updates-tuesday/index.html,CNN
17.3.2020,"Trump, finally, takes the coronavirus emergency seriously",https://edition.cnn.com/2020/03/17/politics/white-house-donald-trump-coronavirus-emergency/index.html,CNN
17.3.2020,Ranskalaiset ul­ko­na­liik­ku­mis­kiel­toon – puo­lus­tus­voi­mat valjastetaan sairaaloiden avuksi,https://www.kaleva.fi/uutiset/ulkomaat/ranskalaiset-ulkonaliikkumiskieltoon-puolustusvoimat-valjastetaan-sairaaloiden-avuksi/837005/,Kaleva
17.3.2020,Tähän Suomen hallitus perustaa ratkaisunsa: Huhtikuun lopulla jopa 6 000 suomalaista voi olla sairaalassa koronan takia,https://yle.fi/uutiset/3-11261761,YLE
17.3.2020,Kaiken takana on loinen: Tämä tulee kestämään kauan,https://www.tiede.fi/blogit/kaiken-takana-loinen/tama-tulee-kestamaan-kauan,Tiede
17.3.2020,Turkey detains 19 people over 'provocative' coronavirus posts,https://www.reuters.com/article/us-health-coronavirus-turkey/turkey-detains-19-people-over-provocative-coronavirus-posts-idUSKBN2140T9?il=0,Reuters
17.3.2020,Suomi sulki itsensä selvästi aiemmin kuin Wuhan ja Italia – Strategia on nyt ottaa tauti hitaasti vastaan muissa kuin riskiryhmissä,https://www.hs.fi/tiede/art-2000006442606.html,HS
17.3.2020,"Hallitus julkaisi koronamuistion – ennusteen mukaan jopa 3 miljoonaa suomalaista voi sairastua, 540 – 3 240 kuolla",https://www.is.fi/politiikka/art-2000006442474.html,Ilta-Sanomat
17.3.2020,"Sijoituspankki JPMorgan arvioi, että Italian pandemiahuippu on seitsemän päivän kuluttua",https://www.reuters.com/article/uk-health-coronavirus-jpm-idUKKBN2141CG?taid=5e70e5aae6e3ff0001400c0b&utm_campaign=trueAnthem%3A+Trending+Content&utm_medium=trueAnthem&utm_source=twitter,Reuters
17.3.2020,Espanjassa nyt lähes 500 koronavirukseen kuollutta,https://www.bbc.com/news/world-europe-51927790,BBC
17.3.2020,New Yorkin pormestarin mukaan kaupunki ei tällä hetkellä suunnittele karanteenia,https://edition.cnn.com/world/live-news/coronavirus-outbreak-03-17-20-intl-hnk/index.html,CNN
17.3.2020,"Hallitus otti heti käyttöön mahdollisuuden rajoittaa lääkkeiden myyntiä – Nämä asiat muuttuvat, kun osia valmiuslaista tulee voimaan",https://www.hs.fi/politiikka/art-2000006443145.html,HS
17.3.2020,"Nämä ovat kriittiset ammatit – valtioneuvosto julkaisi listan, katso se täältä",https://www.mtvuutiset.fi/artikkeli/nama-ovat-kriittiset-ammatit-valtioneuvosto-julkaisi-listan-katso-se-taalta/7764394#gs.0458nh,MTV3
17.3.2020,Johns Hopkins Experts Are Trying a Clever Antibody Method From The 1890s on COVID-19 ,https://l.facebook.com/l.php?u=https%3A%2F%2Fwww.google.fi%2Famp%2Fs%2Fwww.sciencealert.com%2Fa-classic-therapy-from-the-1890s-could-help-protect-against-coronavirus-experts-say%3Ffbclid%3DIwAR0fcUoKNsg3FM_4Te0-w4AW5BQNOlSFgGqlZXYzOFug4w-XlqOnkeZR_Jc&h=AT0swpig4NflhmvEDTDC0PFX_MnVeRYY-_v6wkrzLAV3rJ5BZ0egbrQGh3bVWFRApxAIkGCc_HYr2XauuilI9ug-Y30loJC6HYILEx0c5t9qWZkaPZI5csYiyjU5nMBjPChMesgc,sciencealert
17.3.2020,"Why More Coronavirus Testing Is One of The Most Important Actions Right Now, According to WHO ",https://www.sciencealert.com/who-warns-more-coronavirus-testing-is-needed,sciencealert
17.3.2020,Näkökulma: Ruotsi on tekemässä pahan virheen koronatoimissaan – ottaisi mallia Suomesta,https://www.iltalehti.fi/koronavirus/a/c4baf0e7-4128-4dfa-83df-1d2581f2507a,Iltalehti
18.3.2020,Perustuslakivaliokunta kertoo kantansa valmiuslakiin,https://yle.fi/uutiset/3-11263507,YLE
18.3.2020,The psychology of panic buying: why do we feel the need to stockpile?,https://www.stylist.co.uk/life/coronavirus-panic-buying-shoppers-stockpiling-rationing-toilet-roll-hand-sanitiser-supermarkets-stores/365688,The Stylist
18.3.2020,"Europe Passes China in Confirmed Coronavirus Cases, Deaths",https://www.bloomberg.com/news/articles/2020-03-18/europe-surpasses-china-in-number-of-confirmed-coronavirus-cases,Bloomberg
19.3.2020,HUS on siirtynyt täysvalmiuteen,https://www.is.fi/kotimaa/art-2000006445392.html,Iltasanomat
19.3.2020,Kuinka moni joutuu korona­viruksen vuoksi teho­hoitoon? THL:n luvut poikkeavat selvästi kansain­välisistä arvioista,https://www.hs.fi/politiikka/art-2000006444716.html,HS
20.3.2020,"Tehohoidon ylilääkäri Ylelle: Tehohoitoa joudutaan rajaamaan raskaasti, jos synkimmät ennusteet toteutuvat – 11 tärkeää kysymystä tehohoidosta",https://yle.fi/uutiset/3-11265359?utm_source=twitter-share&utm_medium=social,YLE
20.3.2020,"Suomi lisää korona­viruksen testaus­kapasiteettia, mutta ei ota testeihin lievä­oireisia: ”Emme totta puhuen ymmärrä WHO:n linjausta”, sanoo THL:n Mika Salminen",https://www.hs.fi/kotimaa/art-2000006446009.html,HS
20.3.2020,"Coronavirus Death Rate in Wuhan Is Lower than Previously Thought, Study Finds",https://www.nytimes.com/2020/03/19/health/wuhan-coronavirus-deaths.html?fbclid=IwAR2tODap1x-wF1HyHerS5I3EpXRzrcs0t9__9wCsacng_t2lSfFVyzTo_Sw#click=https://t.co/gB8JEmBjcm,NYT
17.3.2020,UK manufacturers to regear factories to build ventilators for NHS,https://www.theguardian.com/business/2020/mar/17/uk-manufacturers-regear-factories-build-ventilators-nhs,Guardian
13.3.2020,How this South Korean company created coronavirus test kits in three weeks,https://edition.cnn.com/2020/03/12/asia/coronavirus-south-korea-testing-intl-hnk/index.html,CNN
20.3.2020,Coronavirus: Italy's hardest-hit city wants you to see how COVID-19 is affecting its hospitals ,https://news.sky.com/story/coronavirus-they-call-it-the-apocalypse-inside-italys-hardest-hit-hospital-11960597,Sky News
20.3.2020,Finnish health boss questions WHO coronavirus testing advice,https://www.reuters.com/article/us-health-coronavirus-finland-who-idUSKBN2170ZB,Reuters
20.3.2020,Is Iran covering up its outbreak?,https://www.bbc.com/news/world-middle-east-51930856,BBC
20.3.2020,"Coronavirus: COVID-19 cases in Spain and Germany rise by nearly 3,000 overnight",https://news.sky.com/story/coronavirus-number-of-cases-in-germany-rises-by-nearly-3-000-to-13-957-overnight-11960726,Sky News
20.3.2020,"Coronavirus: Number of COVID-19 deaths in Italy surpasses China as total reaches 3,405",https://news.sky.com/story/coronavirus-number-of-covid-19-deaths-in-italy-surpasses-china-as-total-reaches-3-405-11960412,Sky News
19.3.2020,Hallitus nostaa tehohoidon paikkamäärää tuhanteen,https://www.mtvuutiset.fi/artikkeli/krista-kiuru-hallitus-nostaa-tehohoidon-paikkamaaraa-tuhanteen/7766622,MTV
21.3.2020,Hallitus on varautunut rajoittamaan liikkumista Uudeltamaalta muualle Suomeen,https://yle.fi/uutiset/3-11269184,YLE
21.3.2020,THL: Suomessa kuollut ensimmäinen ihminen koronavirukseen,https://yle.fi/uutiset/3-11269508,YLE
21.3.2020,Suojavarusteet paikoin loppumassa,https://yle.fi/uutiset/3-11268965,YLE
